{"schema_version":"1.0.0","delta_id":"delta-ep001","project_id":"novel_example","episode_number":1,"base_state_version":"0.1.0","target_state_version":"0.1.1","changes":[{"target_type":"character","target_id":"inspector","field":"knowledge","before":["the totals do not match"],"after":["the totals do not match","the protagonist knows the old filing code"],"source_id":"episode:001"},{"target_type":"relationship","target_id":"protagonist-inspector","field":"tension","before":70,"after":80,"source_id":"episode:001"}],"continuity_check":{"status":"pass","checked_by":"continuity_editor","findings":[]},"human_approval":{"status":"approved","approval_id":"approval-example","approved_by":"author","approved_at":"2026-06-20T00:00:00Z"}}
